brand,product,url,price
stella and chewys,"Stella & Chewy's Chewy's Chicken Meal Mixers Freeze-Dried Raw Dog Food Topper, 1-oz bag",https://www.chewy.com/stella-chewys-chewys-chicken-meal/dp/612142,1.62
redbarn,"Redbarn Powerfood Digestive Health Beef & Lamb Gently Air Dried Dog Food, 2.5-oz bag",https://www.chewy.com/redbarn-grain-free-beef-lamb-gut/dp/1605566,2.92
stella and chewys,"Stella & Chewy's Stella's Super Beef Dinner Patties Freeze-Dried Raw Dog Food, 14-oz bag",https://www.chewy.com/stella-chewys-stellas-super-beef/dp/34229,23.39
justfoodfordogs,"JustFoodForDogs JustFresh Human Grade Home-Cooked Chicken Recipe Fresh Dog Food, 12-oz pouch",https://www.chewy.com/justfoodfordogs-justfresh-home-cooked/dp/1487430,6.99
portland pet food company,"Portland Pet Food Company Homestyle Variety Pack Wet Dog Food Topper, 9-oz pouch, case of 5",https://www.chewy.com/portland-pet-food-company-homestyle/dp/279347,22.72
pawstruck,"Pawstruck Beef High Protein Grain-Free Air-Dried Dog Food, 32-oz bag",https://www.chewy.com/pawstruck-beef-recipe-grain-free-air/dp/971910,19.48
natures diet,"Nature's Diet Fresh Beef Simply Raw Freeze-Dried Dog Food, 3-lb bag",https://www.chewy.com/natures-diet-fresh-beef-simply-raw/dp/344413,24.34
stella and chewys,"Stella & Chewy's Stella's Super Beef Meal Mixers Freeze-Dried Raw Dog Food Topper, 35-oz bag, bundle of 2",https://www.chewy.com/stella-chewys-stellas-super-beef-meal/dp/109897,110.49
stella and chewys,"Stella & Chewy's Chewy's Chicken Dinner Patties Freeze-Dried Raw Dog Food, 25-oz bag",https://www.chewy.com/stella-chewys-chewys-chicken-dinner/dp/121085,38.99
jinx,"Jinx Freeze-Dried Salmon Dry Dog Food Topper, 3-oz bag",https://www.chewy.com/jinx-freeze-dried-salmon-dry-dog-food/dp/394021,6.49
the honest kitchen,"The Honest Kitchen Bone Broth POUR OVERS Beef Stew Wet Dog Food Topper, 5.5-oz, case of 12",https://www.chewy.com/honest-kitchen-bone-broth-pour-overs/dp/177105,20.2
solid gold,"Solid Gold Homestyle Meal Skin & Coat Health Chicken Dog Food Topper, 9-oz pouch",https://www.chewy.com/solid-gold-homestyle-meal-chicken-dog/dp/1082542,3.23
american natural premium,"American Natural Premium Market Fresh Pork with Pumpkin & Apples Freeze-Dried Dog Food, 4-oz bag",https://www.chewy.com/american-natural-premium-market-fresh/dp/2469302,9.89
solid gold,"Solid Gold Beef Bone Broth with Turmeric Dog Food Topper, 8-oz pouch",https://www.chewy.com/solid-gold-beef-bone-broth-turmeric/dp/176129,2.91
jinx,"Jinx Homemades Grain-Free Beef & Chicken Pate Wet Dog Food Meal Topper, 3-oz pouch, case of 8",https://www.chewy.com/jinx-homemades-grain-free-beef/dp/1709398,6.48
redbarn,"Redbarn Powerfood Digestive Health Beef & Lamb Gently Air Dried Dog Food, 32-oz bag",https://www.chewy.com/redbarn-grain-free-beef-lamb-gut/dp/1605534,26.32
health extension,"Health Extension Gently Cooked Beef & Potato Recipe Wet Dog Food, 9-oz pouch, 1 count",https://www.chewy.com/health-extension-gently-cooked-beef/dp/970062,4.54
health extension,"Health Extension Gently Cooked Grain-Free Variety Pack Wet Dog Food, 3-oz pouch, 20 count",https://www.chewy.com/health-extension-gently-cooked-grain/dp/1724414,25.34
instinct,"Instinct Raw Boost Mixers Gut Health Recipe Grain-Free Freeze-Dried Dog Food Topper, 23-oz bag",https://www.chewy.com/instinct-freeze-dried-raw-boost/dp/170070,35.74
redbarn,"Redbarn Naturals Beef Recipe Dog Food Roll, 64-oz roll",https://www.chewy.com/redbarn-naturals-beef-recipe-dog-food/dp/45769,10.72
health extension,"Health Extension Gently Cooked Chicken & Pumpkin Recipe Wet Dog Food, 9-oz pouch, 10 count",https://www.chewy.com/health-extension-gently-cooked/dp/970038,32.49
justfoodfordogs,"JustFoodForDogs JustFresh Human Grade Home-Cooked Chicken Recipe Fresh Dog Food, 12-oz pouch",https://www.chewy.com/justfoodfordogs-justfresh-home-cooked/dp/1401430,6.99
solid gold,"Solid Gold Turkey Grain-Free Bone Broth with Pumpkin & Ginger Dog Food, 8-oz pouch",https://www.chewy.com/solid-gold-turkey-grain-free-bone/dp/176125,2.91
the honest kitchen,"The Honest Kitchen Daily Boosters Beef Bone Broth with Turmeric for Dogs, 3.6-oz jar",https://www.chewy.com/honest-kitchen-daily-boosters-beef/dp/120153,8.44
simple food project,"Simple Food Project 6-Pack Sample Bundle Freeze-Dried Dog Food, 6-oz",https://www.chewy.com/simple-food-project-6-pack-sample/dp/1996838,12.86
herbsmith,"Herbsmith Smiling Dog Kibble Seasoning Freeze-Dried Beef with Potatoes, Carrots, & Celery Dog Food Topper, 4.87-oz bottle",https://www.chewy.com/herbsmith-smiling-dog-kibble/dp/112287,9.74
instinct,"Instinct Raw Boost Mixers Skin & Coat Health Recipe Grain-Free Freeze-Dried Dog Food Topper, 12.5-oz bag, bundle of 2",https://www.chewy.com/instinct-freeze-dried-raw-boost/dp/187505,41.59
instinct,"Instinct Raw Boost Shakers Chicken Recipe Gut Health Grain-Free Freeze-Dried Dog Food Topper, 5.5-oz bottle",https://www.chewy.com/instinct-raw-boost-shakers-chicken/dp/1076214,12.34
instinct,"Instinct Healthy Cravings Variety Pack Grain-Free Wet Dog Food Topper, 3-oz pouch, case of 36",https://www.chewy.com/instinct-healthy-cravings-grain-free/dp/187495,50.68
blue,"Blue Buffalo Life Protection Formula Adult Chicken & Brown Rice Recipe Dry Dog Food, 30-lb bag",https://www.chewy.com/blue-buffalo-life-protection-formula/dp/32041,44.98
blue,"Blue Buffalo Life Protection Formula Adult Salmon & Brown Rice Recipe Dry Dog Food, 34-lb bag",https://www.chewy.com/blue-buffalo-life-protection-formula/dp/2037718,58.98
beef,"Vital Essentials Freeze-Dried Raw Beef Entree & Mixer Dog Food Crunchy Nibs, 14-oz bag",https://www.chewy.com/vital-essentials-beef-nibs-entree/dp/793582,23.39
stella and chewys,"Stella & Chewy's Marie's Magical Dinner Freeze-Dried Raw Dust Grass-Fed Beef Dog Food Topper, 7-oz bag",https://www.chewy.com/stella-chewys-maries-magical-dinner/dp/203217,14.94
puppy chow,"Puppy Chow Complete with Real Chicken Dry Dog Food, 30-lb bag",https://www.chewy.com/puppy-chow-complete-real-chicken-dry/dp/767790,17.8
stella and chewys,"Stella & Chewy's Chewy's Chicken Meal Mixers Freeze-Dried Raw Dog Food Topper, 18-oz bag",https://www.chewy.com/stella-chewys-chewys-chicken-meal/dp/109901,28.59
jinx,"Jinx Homemades Grain-Free Beef & Chicken Pate Wet Dog Food, 9-oz pouch, case of 12",https://www.chewy.com/jinx-beef-chicken-homestyle-grain/dp/765670,28.7
nutrish,"Nutrish Whole Health Blend Puppy Real Chicken & Brown Rice Recipe Dry Dog Food, 14-lb bag",https://www.chewy.com/rachael-ray-nutrish-bright-puppy/dp/156892,15.33
blue,"Blue Buffalo Life Protection Formula Puppy Chicken & Brown Rice Recipe Dry Dog Food, 30-lb bag",https://www.chewy.com/blue-buffalo-life-protection-formula/dp/32079,61.73
chicken,"Gentle Giants Natural Non-GMO Dog & Puppy Chicken Dry Dog Food, 30-lb bag",https://www.chewy.com/gentle-giants-natural-non-gmo-dog/dp/248670,50.99
blue,"Blue Buffalo Wilderness Chicken Recipe High-Protein Puppy Dry Dog Food, 24-lb bag",https://www.chewy.com/blue-buffalo-wilderness-puppy-high/dp/733510,48.98
puppy chow,"Puppy Chow Tender & Crunchy with Real Beef Dry Dog Food, 30-lb bag",https://www.chewy.com/puppy-chow-tender-crunchy-real-beef/dp/767774,17.8
jinx,"Jinx Salmon & Chicken Homemades Grain-Free Wet Dog Food, 9-oz pouch, case of 12",https://www.chewy.com/jinx-homemades-chicken-salmon-pate/dp/1709070,31.19
natures recipe,"Nature's Recipe Grain-Free Puppy Chicken, Sweet Potato, & Pumpkin Recipe Dry Dog Food, 12-lb bag",https://www.chewy.com/natures-recipe-grain-free-puppy/dp/115537,19.49
country vet naturals,"Country Vet Naturals 28/18 Healthy Puppy Dog Food, 35-lb bag",https://www.chewy.com/country-vet-naturals-2818-healthy/dp/225810,29.84
victor,"VICTOR Grain-Free Active High Protein Dry Dog Food, 30-lb bag",https://www.chewy.com/victor-purpose-active-dog-puppy/dp/120700,45.69
puppy chow,"Puppy Chow High Protein with Real Chicken Large Breed Dry Puppy Food, 30-lb bag",https://www.chewy.com/puppy-chow-high-protein-real-chicken/dp/127755,17.8
puppy chow,"Puppy Chow Complete with Real Lamb & Rice High Protein Dry Dog Food, 15-lb bag",https://www.chewy.com/puppy-chow-complete-real-lamb-rice/dp/1496606,10.13
blue,"Blue Buffalo Life Protection Formula Large Breed Puppy Chicken & Brown Rice Recipe Dry Dog Food, 30-lb bag",https://www.chewy.com/blue-buffalo-life-protection-formula/dp/32084,61.73
purina beneful,"Purina Beneful Healthy Puppy with Farm Raised Chicken High Protein Dry Dog Food, 14-lb bag",https://www.chewy.com/purina-beneful-healthy-puppy-farm/dp/200458,10.71
beef bacon,"Gentle Giants Natural Non-GMO Dog & Puppy Beef & Bacon Dry Dog Food, 24-lb bag",https://www.chewy.com/gentle-giants-natural-non-gmo-dog/dp/241121,50.99
blue,"Blue Buffalo Wilderness Red Meat & Grains Rocky Mountain Recipe High-Protein Puppy Dry Dog Food, 24-lb bag",https://www.chewy.com/blue-buffalo-wilderness-rocky/dp/735614,57.99
american journey,"American Journey Premium Loaf Poultry & Beef Variety Pack Grain-Free Canned Dog Food, 12.5-oz can, case of 12",https://www.chewy.com/american-journey-poultry-beef-variety/dp/160899,19.49
natures recipe,"Nature's Recipe Grain-Free Chicken & Venison Recipe in Broth Wet Dog Food, 2.75-oz, case of 24",https://www.chewy.com/natures-recipe-grain-free-chicken/dp/48801,13.57
purina beyond,"Purina Beyond Alaskan Cod, Salmon & Sweet Potato Grain-Free Canned Dog Food, 13-oz, case of 12",https://www.chewy.com/purina-beyond-alaskan-cod-salmon/dp/169331,30.16
natures recipe,"Nature's Recipe Variety Pack Grain-Free Wet Dog Food, 2.75-oz, case of 12",https://www.chewy.com/natures-recipe-variety-pack-grain/dp/234457,9.68
blue,"Blue Buffalo's Stew Chicken & Beef Variety Pack Wet Dog Food,12.5-oz can, case of 6",https://www.chewy.com/blue-buffalos-stew-chicken-beef/dp/735678,11.43
purina beneful,"Purina Beneful Freshly Prepared Meals Variety Pack Wet Dog Food, 10-oz, case of 12",https://www.chewy.com/purina-beneful-prepared-meals-variety/dp/143861,17.87
jinx,"Jinx Kibble Sauce Beef Bone Broth Wet Dog Food Topper, 12-fl oz bottle, 12-fl oz bottle, bundle of 2",https://www.chewy.com/jinx-kibble-sauce-beef-bone-broth-wet/dp/1709486,8.97
purina beneful,"Purina Beneful IncrediBites Adult Variety Pack Chicken Beef & Salmon Small Breed Wet Dog Food, 3-oz, case of 12",https://www.chewy.com/purina-beneful-incredibites-variety/dp/143859,6.99
koha,"KOHA Pure Shreds Duck Entree High Protein Wet Dog Food, 12.5-oz can, case of 12",https://www.chewy.com/koha-pure-shreds-duck-entree-high/dp/2261070,68.29
stella and chewys,"Stella & Chewy's Dandy Lamb Dinner Patties Freeze-Dried Raw Dog Food, 25-oz bag",https://www.chewy.com/stella-chewys-dandy-lamb-dinner/dp/168120,38.99
natures recipe,"Nature's Recipe Variety Pack Grain-Free Wet Dog Food, 2.75-oz, case of 12",https://www.chewy.com/natures-recipe-variety-pack-grain/dp/234458,9.68
purina beyond,"Purina Beyond Grain-Free Chicken & Beef Variety Pack Canned Dog Food, 13-oz, case of 12",https://www.chewy.com/purina-beyond-grain-free-chicken-beef/dp/182032,14.36
jinx,"Jinx Kibble Sauce Chicken Bone Broth Wet Dog Food Topper, 12-fl oz bottle",https://www.chewy.com/jinx-kibble-sauce-chicken-bone-broth/dp/1709462,3.23
evangers,"Evanger's Classic Recipes Cooked Chicken Grain-Free Canned Dog Food, 12.5-oz, case of 12",https://www.chewy.com/evangers-classic-recipes-cooked/dp/35930,16.24
blue,"Blue Buffalo Homestyle Recipe Turkey Meatloaf Dinner with Garden Vegetables Canned Dog Food, 12.5-oz, case of 12",https://www.chewy.com/blue-buffalo-homestyle-recipe-turkey/dp/31985,22.26
health extension,"Health Extension Little Cups Chicken & Turkey Recipe Variety Pack Small Breed Grain-Free Wet Puppy Food, 3.5-oz can, case of 12",https://www.chewy.com/health-extension-little-cups-chicken/dp/285466,20.79
i and love and you,"I and Love and You Beef Booyah and Lambarama Stew Grain-Free Combo Pack Canned Dog Food, 13-oz, case of 6",https://www.chewy.com/i-love-you-beef-booyah-lambarama-stew/dp/157231,11.21
blue,"Blue Buffalo Divine Delights Gravy Variety Pack Filet Mignon & NY Strip Flavor Dog Food Trays, 3.5-oz, case of 12",https://www.chewy.com/blue-buffalo-divine-delights-gravy/dp/141564,11.23
purina beneful,"Purina Beneful Medleys Tuscan, Romana & Mediterranean Style Variety Pack in Gravy Wet Dog Food, 3-oz can, case of 30",https://www.chewy.com/purina-beneful-medleys-tuscan-romana/dp/127666,16.39
evangers,"Evanger's Classic Recipes Beef & Bacon Grain-Free Canned Dog Food, 12.5-oz, case of 12",https://www.chewy.com/evangers-classic-recipes-beef-bacon/dp/35948,18.06
koha,"KOHA Pure Shreds Variety Pack High Protein Wet Dog Food, 12.5-oz can, case of 6",https://www.chewy.com/koha-pure-shreds-variety-pack-high/dp/2261158,28.02
natures recipe,"Nature's Recipe Chicken & Lamb Recipe in Savory Broth Grain-Free Wet Dog Food, 2.75-oz tray, case of 24",https://www.chewy.com/natures-recipe-chicken-lamb-recipe-in/dp/181446,16.29
purina beyond,"Purina Beyond Organic Chicken & Sweet Potato Recipe Wet Dog Food, 13-oz can, case of 12",https://www.chewy.com/purina-beyond-organic-chicken-sweet/dp/260188,19.45
nutrish,"Nutrish Healthy Weight Real Turkey & Pumpkin Recipe Premium Pate Wet Dog Food, 13-oz can, case of 12 (Rachael Ray)",https://www.chewy.com/rachael-ray-nutrish-weight-management/dp/399646,16.87
nutrish,"Nutrish Whole Health Blend Real Beef, Pea, & Brown Rice Recipe Dry Dog Food, 6-lb bag",https://www.chewy.com/rachael-ray-nutrish-real-beef-pea/dp/36742,6.49
blue,"Blue Buffalo Homestyle Recipe Variety Pack Adult Lamb & Turkey Canned Dog Food, 12.5-oz, case of 6",https://www.chewy.com/blue-buffalo-homestyle-recipe-variety/dp/922766,11.43
nutrish,"Nutrish Whole Health Blend Real Chicken & Veggies Recipe Dry Dog Food, 50-lb bag",https://www.chewy.com/rachael-ray-nutrish-real-chicken/dp/36743,42.99
blue,"Blue Buffalo Life Protection Formula Adult Chicken & Brown Rice Recipe Dry Dog Food, 34-lb bag",https://www.chewy.com/blue-buffalo-life-protection-formula/dp/28801,72.98
purina beneful,"Purina Beneful Originals with Farm-Raised Beef Real Meat Dog Food, 14-lb bag",https://www.chewy.com/purina-beneful-originals-farm-raised/dp/28736,10.71
rachael ray nutrish,"Rachael Ray Nutrish Gentle Digestion Variety Pack Canned Dog Food, 13-oz can, case of 12",https://www.chewy.com/rachael-ray-nutrish-gentle-digestion/dp/1021598,18.65
gentle giants,"Gentle Giants Natural Non-GMO Dog & Puppy Chicken Dry Dog Food, 15-lb bag",https://www.chewy.com/gentle-giants-natural-non-gmo-dog/dp/133779,24.99
blue,"Blue Buffalo Homestyle Recipe Chicken & Beef Wet Dog Food, 12.5-oz can, case of 6",https://www.chewy.com/blue-buffalo-homestyle-recipe-chicken/dp/748342,11.43
rachael ray nutrish,"Rachael Ray Nutrish Variety Pack Wet Dog Food, 8-oz tub, case of 6",https://www.chewy.com/rachael-ray-nutrish-natural-variety/dp/128025,8.37
blue,"Blue Buffalo Homestyle Recipe Chicken Dinner with Garden Vegetables & Brown Rice Canned Dog Food, 12.5-oz, case of 12",https://www.chewy.com/blue-buffalo-homestyle-recipe-chicken/dp/31991,21.79
dog chow,"Dog Chow Complete Adult with Real Chicken Dry Dog Food, 4.4-lb bag",https://www.chewy.com/dog-chow-complete-adult-real-chicken/dp/127732,3.89
nutrish,"Nutrish Whole Health Blend Real Salmon, Veggies & Brown Rice Recipe Gentle Digestion Dry Dog Food, 13-lb bag",https://www.chewy.com/rachael-ray-nutrish-real-salmon/dp/824982,13.61
dog chow,"Dog Chow Complete Adult with Beef Flavor Dry Dog Food, 40-lb bag",https://www.chewy.com/dog-chow-complete-adult-real-beef-dry/dp/158685,18.19
natures recipe,"Nature's Recipe Grain-Free Salmon, Sweet Potato & Pumpkin Recipe Dry Dog Food, 12-lb bag",https://www.chewy.com/natures-recipe-grain-free-salmon/dp/36554,19.49
merrick pet care,"Merrick Real Texas Beef + Sweet Potato Recipe Grain-Free Chicken-Free Adult Dry Dog Food, 30-lb bag",https://www.chewy.com/merrick-real-texas-beef-sweet-potato/dp/47173,73.98
jinx,"Jinx Beef, Brown Rice & Sweet Potato ALS Kibble Dog Dry Food, 11.5-lb bag",https://www.chewy.com/jinx-beef-brown-rice-sweet-potato-als/dp/765574,15.56
blue,"Blue Buffalo Life Protection Formula Small Breed Adult Chicken & Brown Rice Recipe Dry Dog Food, 15-lb bag",https://www.chewy.com/blue-buffalo-life-protection-formula/dp/28806,27.29
next level super premium pet food,"Next Level Super Premium Pet Food Hi-Pro Professional Adult Gluten-Free Beef Dry Dog Food, 40-lb bag",https://www.chewy.com/next-level-super-premium-pet-food-hi/dp/1343262,17.21
kibbles n bits,"Kibbles 'n Bits Original Savory Beef & Chicken Flavors Dry Dog Food, 45-lb bag",https://www.chewy.com/kibbles-n-bits-original-savory-beef/dp/161040,17.53
blue,"Blue Buffalo Natural Veterinary Diet GI Gastrointestinal Support Dry Dog Food, 22-lb bag",https://www.chewy.com/blue-buffalo-natural-veterinary-diet/dp/174502,79.98
justfoodfordogs,"JustFoodForDogs Veterinary Diet Renal Support Low Protein Frozen Human-Grade Fresh Dog Food, 18-oz pouch, case of 7",https://www.chewy.com/justfoodfordogs-veterinary-diet-renal/dp/394324,59.14
blue,"Blue Buffalo Natural Veterinary Diet KS Kidney Support Dry Dog Food, 6-lb bag",https://www.chewy.com/blue-buffalo-natural-veterinary-diet/dp/744534,24.69
stella and chewys,"Stella & Chewy's Stella's Super Beef Dinner Patties Freeze-Dried Raw Dog Food, 14-oz bag",https://www.chewy.com/stella-chewys-stellas-super-beef/dp/34229,23.39
solid gold,"Solid Gold Homestyle Meal Gut Health Beef Dog Food Topper, 9-oz pouch",https://www.chewy.com/solid-gold-homestyle-meal-beef-dog/dp/1082598,3.23
solid gold,"Solid Gold Mobility Support Beef & Vegetables Wet Dog Food, 3.5-oz cup, case of 6",https://www.chewy.com/solid-gold-mobility-support-beef/dp/1082534,9.71
merrick pet care,"Merrick Grain-Free Dry Dog Food Real Bison, Beef & Sweet Potato Recipe, 22-lb bag",https://www.chewy.com/merrick-grain-free-dry-dog-food-real/dp/230017,57.98
kibbles n bits,"Kibbles 'n Bits Bistro Oven Roasted Beef, Spring Vegetable & Apple Flavor Dry Dog Food, 3.5-lb bag",https://www.chewy.com/kibbles-n-bits-bistro-oven-roasted/dp/161023,4.22
blue,"Blue Buffalo Life Protection Formula Senior Chicken & Brown Rice Recipe Dry Dog Food, 34-lb bag",https://www.chewy.com/blue-buffalo-life-protection-formula/dp/28808,52.98
merrick pet care,"Merrick Beef Bone Broth Grain-Free Wet Dog & Cat Food Topper, 7-oz pouch",https://www.chewy.com/merrick-beef-bone-broth-grain-free/dp/253747,3.04
merrick pet care,"Merrick Turkey Bone Broth Grain-Free Wet Dog & Cat Food Topper, 7-oz pouch",https://www.chewy.com/merrick-turkey-bone-broth-grain-free/dp/253753,3.05
the honest kitchen,"The Honest Kitchen Bone Broth POUR OVERS Turkey & Salmon Stew Wet Dog Food Topper, 5.5-oz, case of 12",https://www.chewy.com/honest-kitchen-bone-broth-pour-overs/dp/177103,20.2
redbarn,"Redbarn Powerfood Digestive Health Chicken & Turkey Gently Air Dried Dog Food, 2.5-oz bag",https://www.chewy.com/redbarn-grain-free-chicken-turkey-gut/dp/1605510,2.92
stella and chewys,"Stella & Chewy's Chewy's Chicken Dinner Patties Freeze-Dried Raw Dog Food, 25-oz bag",https://www.chewy.com/stella-chewys-chewys-chicken-dinner/dp/121085,38.99
maev,"MAEV Anxiety & Calming Human-Grade Raw Frozen Beef Dog Food, 5-lb bag",https://www.chewy.com/maev-beef-formula-supplemented/dp/1554094,51.35
merrick pet care,"Merrick Fresh Selects Frozen Turkey & Brown Rice Dog Food, 18-oz pouch, 7 count",https://www.chewy.com/merrick-fresh-selects-frozen-turkey/dp/1915070,33.95
instinct,"Instinct Raw Boost Shakers All Natural Beef Recipe High-Protein Grain-Free Freeze-Dried Dog Food Topper, 5.5-oz bottle",https://www.chewy.com/instinct-raw-boost-shakers-all/dp/1076126,11.69
justfoodfordogs,"JustFoodForDogs Sampler Variety Box Frozen Human-Grade Fresh Dog Food, 18-oz pouch, case of 7",https://www.chewy.com/justfoodfordogs-sampler-variety-box/dp/536774,41.99
health extension,"Health Extension Gently Cooked Grain-Free Vegetarian Recipe Wet Dog Food, 3-oz pouch, 10 count",https://www.chewy.com/health-extension-gently-cooked-grain/dp/1724358,12.99
stella and chewys,"Stella & Chewy's Dandy Lamb Dinner Patties Freeze-Dried Raw Dog Food, 25-oz bag",https://www.chewy.com/stella-chewys-dandy-lamb-dinner/dp/168120,38.99
justfoodfordogs,"JustFoodForDogs Veterinary Diet Hepatic Support Low Fat Frozen Human-Grade Fresh Dog Food, 18-oz pouch, case of 7",https://www.chewy.com/justfoodfordogs-veterinary-diet/dp/394339,50.04
solid gold,"Solid Gold Complete & Balanced Beef Recipe Air Dried Dog Food Topper, 1-lb pouch",https://www.chewy.com/solid-gold-complete-balanced-beef/dp/978094,17.54
instinct,"Instinct Raw Boost Mixers Mobility Support Recipe Grain-Free Freeze-Dried Dog Food Topper, 5.5-oz bag",https://www.chewy.com/instinct-freeze-dried-raw-boost/dp/170074,10.39
health extension,"Health Extension Gently Cooked Lamb & Carrot Recipe Wet Dog Food, 9-oz pouch, 1 count",https://www.chewy.com/health-extension-gently-cooked-lamb/dp/1980478,4.54
merrick pet care,"Bundle: Merrick Fresh Selects Beef & Brown Rice + Chicken & Brown Rice + Turkey & Brown Rice Frozen Dog Food, 18-oz pouch",https://www.chewy.com/merrick-fresh-selects-beef-brown-rice/dp/2289270,21.01
blue,Bundle: Blue Buffalo Blue's Hearty Beef Stew + Blue's Country Chicken Stew Canned Dog Food,https://www.chewy.com/blue-buffalo-blues-hearty-beef-stew/dp/971142,41.92
koha,"KOHA Limited Ingredient Diet Salmon Entree Grain-Free Wet Dog Food, 13-oz can, case of 3",https://www.chewy.com/koha-limited-ingredient-diet-salmon/dp/2260798,19.99
stella and chewys,"Stella & Chewy's Marie's Magical Breakfast Sprinkles Freeze-Dried Raw Bacon, Egg & Cheese Recipe Grain-Free Dog Food Topper, 7-oz bag",https://www.chewy.com/stella-chewys-maries-magical/dp/1551886,18.19
purebites,"PureBites Dog Pates Chicken & Pumpkin Food Topping, 2.5-oz can, 12 count",https://www.chewy.com/purebites-dog-pates-chicken-pumpkin/dp/382696,12.4
jinx,"Jinx Chicken & Salmon Homemades Grain-Free Wet Dog Food Meal Topper, 3-oz pouch, case of 8",https://www.chewy.com/jinx-salmon-chicken-homemades-grain/dp/1709318,6.6
blue,Bundle: Blue Buffalo's Stew Chicken & Beef Variety Pack + Homestyle Recipe Chicken & Beef Wet Dog Food,https://www.chewy.com/blue-buffalos-stew-chicken-beef/dp/916254,20.57
purina beyond,"Purina Beyond Natural Grain-Free Beef Potato & Green Bean Recipe Ground Entree Wet Dog Food, 13-oz can, case of 12",https://www.chewy.com/purina-beyond-natural-grain-free-beef/dp/113995,18.2
blue,"Blue Buffalo Natural Veterinary Diet HF Hydrolyzed for Food Intolerance Grain-Free Dry Dog Food, 22-lb bag",https://www.chewy.com/blue-buffalo-natural-veterinary-diet/dp/174505,89.98
stella and chewys,"Stella & Chewy's Marie's Magical Dinner Dust What's Shak'n Bac'n Recipe Freeze-Dried Raw Dog Food Topper, 7-oz bag",https://www.chewy.com/stella-chewys-maries-magical-dinner/dp/261661,18.19
purina beneful,"Purina Beneful Medleys Tuscan Style with Beef in Sauce Wet Dog Food, 3-oz, pack of 3",https://www.chewy.com/purina-beneful-medleys-tuscan-style/dp/127661,1.78
rachael ray nutrish,"Rachael Ray Nutrish PEAK Grain-Free Adventure Variety Pack Wet Dog Food, 3.5-oz, case of 18",https://www.chewy.com/rachael-ray-nutrish-peak-grain-free/dp/169320,17.8
instinct,"Instinct Raw Frozen Adult Bites Grain-Free Real Beef Recipe Dog Food, 6-lb bag",https://www.chewy.com/instinct-frozen-raw-bites-grain-free/dp/170861,22.49
vital essentials,"Vital Essentials Freeze-Dried Raw Beef Entree & Mixer Dog Food Crunchy Nibs, 14-oz bag",https://www.chewy.com/vital-essentials-beef-nibs-entree/dp/793582,23.39
stella and chewys,"Stella & Chewy's Tantalizing Turkey Meal Mixers Freeze-Dried Raw Dog Food Topper, 3.5-oz bag",https://www.chewy.com/stella-chewys-tantalizing-turkey-meal/dp/109905,7.14
the pets table,"The Pets Table Chicken & Sweet Potato Air-Dried Dog Food, 48-oz bag",https://www.chewy.com/pets-table-chicken-sweet-potato-no/dp/1192262,34.12
jinx,"Jinx Homemades Grain-Free Chicken Pate Wet Dog Food, 9-oz pouch, case of 12",https://www.chewy.com/jinx-chicken-homestyle-wet-dog-food-9/dp/765654,28.7
jinx,"Jinx Homemades Grain-Free Chicken Pate Wet Dog Food Meal Topper, 3-oz pouch, case of 8",https://www.chewy.com/jinx-homemades-grain-free-chicken/dp/1709382,6.34
purebites,"PureBites Plus Squeezables- Skin & Coat Dog Food Toppings, 2.5-oz tube",https://www.chewy.com/purebites-plus-squeezables-skin-coat/dp/382714,1.99
natures recipe,"Nature's Recipe Variety Pack Grain-Free Wet Dog Food, 2.75-oz, case of 12",https://www.chewy.com/natures-recipe-variety-pack-grain/dp/234458,9.68
health extension,"Health Extension Gently Cooked Grain-Free Salmon Recipe Wet Dog Food, 3-oz pouch, 20 count",https://www.chewy.com/health-extension-gently-cooked-grain/dp/1724238,27.29
purina beyond,"Purina Beyond Chicken, Carrot & Pea Recipe Ground Entrée Grain-Free Canned Dog Food, 13-oz, case of 12",https://www.chewy.com/purina-beyond-chicken-carrot-pea/dp/113997,15.7
blue,"Blue Buffalo Delectables Chicken & Beef Dinner Variety Pack Grain-Free Wet Dog Food Topper, 3-oz pouches, case of 24",https://www.chewy.com/blue-buffalo-delectables-chicken-beef/dp/238821,23.39
jinx,"Jinx Bone Broth Stew Chicken & Salmon Variety Pack Wet Dog Food, 13-oz can, case of 12",https://www.chewy.com/jinx-bone-broth-stew-chicken-salmon/dp/1889894,22.94
blue,"Blue Buffalo Wilderness Beef & Salmon Variety Pack Wet Dog Food, 12.5-oz can, case of 6",https://www.chewy.com/blue-buffalo-wilderness-beef-salmon/dp/735414,12.47
evangers,"Evanger's Classic Recipes Beef with Chicken & Liver Grain-Free Canned Dog Food, 12.5-oz, case of 12",https://www.chewy.com/evangers-classic-recipes-beef-chicken/dp/35949,17.86
rachael ray nutrish,"Rachael Ray Nutrish Hearty Recipes Variety Pack Wet Dog Food, 8-oz tub, case of 12",https://www.chewy.com/rachael-ray-nutrish-natural-hearty/dp/170584,16.74
rachael ray nutrish,"Rachael Ray Nutrish Gentle Digestion Variety Pack Canned Dog Food, 13-oz can, case of 12",https://www.chewy.com/rachael-ray-nutrish-gentle-digestion/dp/1021598,18.65
