brand,product,url,price
stella and chewys,"Stella & Chewy's Stella's Solutions Skin & Coat Support Freeze-Dried Raw Grass-Fed Lamb & Wild-Caught Salmon Dinner Morsels Dog Food, 13-oz bag",https://www.chewy.com/stella-chewys-stellas-solutions-skin/dp/203205,20.79
justfoodfordogs,"JustFoodForDogs Sampler Variety Box Frozen Human-Grade Fresh Dog Food, 18-oz pouch, case of 7",https://www.chewy.com/justfoodfordogs-sampler-variety-box/dp/536782,41.99
stella and chewys,"Stella & Chewy's Stella's Super Beef Dinner Patties Freeze-Dried Raw Dog Food, 14-oz bag",https://www.chewy.com/stella-chewys-stellas-super-beef/dp/34229,23.39
first light farms,"First Light Farms Wagyu Beef 100% Grass Fed Raw Freeze-Dried Dog Food, 24-oz bag",https://www.chewy.com/first-light-farms-wagyu-beef-100/dp/1469062,44.19
blackwood,"Blackwood Meal Toppers Beef & Sweet Potato Recipe High-Protein Freeze-Dried Dog Food Topper, 8-oz bag",https://www.chewy.com/blackwood-meal-toppers-beef-sweet/dp/1457438,14.87
purebites,"PureBites Broth Chicken & Vegetables Dog Food Topping, 2-oz bag, 18 count",https://www.chewy.com/purebites-broth-chicken-vegetables/dp/639438,23.28
nutrish,"Nutrish Whole Health Blend Chunks in Gravy Variety Pack Dog Wet Food, 13-oz can, 12 count",https://www.chewy.com/rachael-ray-nutrish-chunks-in-gravy/dp/742110,18.65
the honest kitchen,"The Honest Kitchen Whole Grain Chicken Recipe Dehydrated Dog Food, 10-lb box",https://www.chewy.com/honest-kitchen-whole-grain-chicken/dp/113486,50.95
rachael ray nutrish,"Rachael Ray Nutrish Savory Lamb Stew Wet Dog Food, 8-oz tub, case of 16",https://www.chewy.com/rachael-ray-nutrish-natural-savory/dp/36749,25.9
health extension,"Health Extension Gently Cooked Lamb & Carrot Recipe Wet Dog Food, 9-oz pouch, 1 count",https://www.chewy.com/health-extension-gently-cooked-lamb/dp/1980478,4.54
blue,"Blue Buffalo Homestyle Recipe Turkey Meatloaf Dinner with Garden Vegetables Canned Dog Food, 12.5-oz, case of 12",https://www.chewy.com/blue-buffalo-homestyle-recipe-turkey/dp/31985,22.26
purina beyond,"Purina Beyond Wild Prey-Inspired Grain-Free High Protein Turkey, Liver & Duck Pate Recipe Canned Dog Food, 13-oz, case of 12",https://www.chewy.com/purina-beyond-wild-prey-inspired/dp/174849,22.44
blue,"Blue Buffalo Divine Delights Rotisserie Chicken Flavor in Hearty Gravy Small Breed Wet Dog Food, 3.5-oz tray, case of 12",https://www.chewy.com/blue-buffalo-divine-delights-roasted/dp/141571,12.21
stella and chewys,"Stella & Chewy's Chewy's Chicken Dinner Patties Freeze-Dried Raw Dog Food, 25-oz bag",https://www.chewy.com/stella-chewys-chewys-chicken-dinner/dp/121085,38.99
blue,"Blue Buffalo Homestyle Recipe Chicken Dinner with Garden Vegetables & Brown Rice Canned Dog Food, 12.5-oz, case of 12",https://www.chewy.com/blue-buffalo-homestyle-recipe-chicken/dp/28769,21.79
nulo,"Nulo Gently-Cooked Meals Pork & Apple Recipe Wet Dog Food, 9-oz pouch, case of 8",https://www.chewy.com/nulo-adult-high-protein-pork-apple/dp/1111798,39.92
american journey,"American Journey Protein & Grains Beef, Brown Rice & Vegetables Recipe Dry Dog Food, 14-lb bag",https://www.chewy.com/american-journey-protein-grains-beef/dp/136730,22.74
natures recipe,"Nature's Recipe Variety Pack Grain-Free Wet Dog Food, 2.75-oz, case of 12",https://www.chewy.com/natures-recipe-variety-pack-grain/dp/234458,9.68
nutrish,"Nutrish Dish Chicken & Brown Rice Recipe with Veggie & Fruit Blend Dry Dog Food, 11.5-lb bag (Rachael Ray)",https://www.chewy.com/rachael-ray-nutrish-dish-natural/dp/126241,16.24
petplate,"PetPlate Human Grade Variety Pack Beef, Chicken, Lamb, Pork, Turkey & Venison Fresh Dog Food, 12-oz cup, case of 6",https://www.chewy.com/petplate-human-grade-variety-sample/dp/878654,32.73
justfoodfordogs,"JustFoodForDogs Sampler Variety Box Frozen Human-Grade Fresh Dog Food, 18-oz pouch, case of 7",https://www.chewy.com/justfoodfordogs-sampler-variety-box/dp/536782,41.99
petplate,"PetPlate FreshBaked Beef Gently Baked & Air-Dried Human-Grade Dog Food, 32-oz box",https://www.chewy.com/petplate-freshbaked-human-grade-beef/dp/1343462,13.49
true acre foods,"True Acre Foods Grain-Free Chicken & Vegetable Dry Dog Food, 40-lb bag",https://www.chewy.com/true-acre-foods-grain-free-chicken/dp/176999,35.09
health extension,"Health Extension Salmon Recipe Freeze-Dried Raw Dog Food, 12-oz bag",https://www.chewy.com/health-extension-super-bites-salmon/dp/236290,22.74
puppy chow,"Puppy Chow Complete with Real Chicken Dry Dog Food, 4-lb bag",https://www.chewy.com/puppy-chow-complete-real-chicken-dry/dp/127679,3.74
inukshuk,"Inukshuk Professional Dry Dog Food 26/16, 33-lb bag",https://www.chewy.com/inukshuk-professional-dry-dog-food/dp/149199,51.45
natural balance,"Natural Balance Limited Ingredient Reserve Grain-Free Sweet Potato & Venison Recipe Dry Dog Food, 12-lb bag",https://www.chewy.com/natural-balance-limited-ingredient/dp/29466,34.44
instinct,"Instinct Raw Boost Shakers Cage-Free Chicken Recipe High-Protein Grain-Free Freeze-Dried Dog Food Topper, 5.5-oz bottle",https://www.chewy.com/instinct-raw-boost-shakers-cage-free/dp/1076198,11.62
kibbles n bits,"Kibbles 'n Bits Savory Bacon & Steak Flavor Dry Dog Food, 3.5-lb bag",https://www.chewy.com/kibbles-n-bits-bacon-steak-flavor-dry/dp/1041014,5.84
jinx,"Jinx Grass-Fed Lamb, Sweet Potato & Carrot Dry Dog Food, 11.5-lb bag",https://www.chewy.com/jinx-grass-fed-lamb-sweet-potato/dp/1709358,19.49
redbarn,"Redbarn Powerfood Skin & Coat Fish & Lamb Gently Air-Dried Dog Food, 2.5-oz bag, 2.5-oz bag",https://www.chewy.com/redbarn-powerfood-skin-coat-fish-lamb/dp/2076838,3.06
victor,"VICTOR Classic Hi-Pro Plus Small & Medium Breed Puppy Dry Dog Food, 5-lb bag",https://www.chewy.com/victor-classic-hi-pro-plus-small/dp/2151014,11.69
justfoodfordogs,"JustFoodForDogs JustFresh Home-Cooked Beef & Chicken Recipe Fresh Dog Food, 12-oz pouch, case of 8",https://www.chewy.com/justfoodfordogs-justfresh-home-cooked/dp/1939366,29.96
pawstruck,"Pawstruck Chicken High Protein Grain-Free Air-Dried Dog Food, 32-oz bag",https://www.chewy.com/pawstruck-chicken-recipe-grain-free/dp/971934,19.48
stella and chewys,"Stella & Chewy's Stella's Shredrs Adult Grain-Free Grass Fed Beef & Wild Caught Salmon Recipe in Broth Wet Dog Food, 2.8-oz pouch, case of 12",https://www.chewy.com/stella-chewys-stellas-shredrs-adult/dp/1551838,19.19
stella and chewys,"Stella & Chewy's Marie's Magical Dinner Dust Duck Duck, Goose Recipe Freeze-Dried Raw Dog Food Topper, 7-oz bag",https://www.chewy.com/stella-chewys-maries-magical-dinner/dp/261659,14.94
weruva,"Weruva Baron's Batch Variety Pack Grain-Free Canned Dog Food, 5.5-oz, case of 24",https://www.chewy.com/weruva-barons-batch-variety-pack/dp/169219,42.99
justfoodfordogs,"JustFoodForDogs Pantry Fresh Lamb & Brown Rice Fresh Dog Food, 12.5-oz pouch, case of 12",https://www.chewy.com/justfoodfordogs-pantry-fresh-lamb/dp/394355,50.99
blue,"Blue Buffalo Homestyle Recipe Lamb Dinner with Garden Vegetables Canned Dog Food, 12.5-oz, case of 12",https://www.chewy.com/blue-buffalo-homestyle-recipe-lamb/dp/28767,23.32
victor,"VICTOR Classic Hi-Pro Plus Small & Medium Breed Puppy Dry Dog Food, 15-lb bag",https://www.chewy.com/victor-classic-hi-pro-plus-small/dp/2151022,26.95
natures recipe,"Nature's Recipe Adult Lamb, Barley & Brown Rice Recipe Dry Dog Food, 4-lb bag",https://www.chewy.com/natures-recipe-adult-lamb-barley/dp/36557,3.95
stella and chewys,"Stella & Chewy's Dandy Lamb Dinner Patties Freeze-Dried Raw Dog Food, 25-oz bag",https://www.chewy.com/stella-chewys-dandy-lamb-dinner/dp/168120,38.99
merrick pet care,"Merrick Limited Ingredient Diet Real Salmon & Brown Rice Recipe with Healthy Grains Dry Dog Food, 22-lb bag",https://www.chewy.com/merrick-limited-ingredient-diet-real/dp/229726,55.98
inception,"Inception Pork Recipe Dry Dog Food, 27-lb bag",https://www.chewy.com/inception-pork-recipe-dry-dog-food/dp/231932,35.74
portland pet food company,"Portland Pet Food Company Rosie's Beef N' Rice Homestyle Wet Dog Food Topper, 9-oz pouch, case of 4",https://www.chewy.com/portland-pet-food-company-rosies-beef/dp/279337,18.17
solid gold,"Solid Gold Chicken Bone Broth with Lavender & Chamomile Dog Food Topper, 8-oz pouch, bundle of 12",https://www.chewy.com/solid-gold-chicken-bone-broth/dp/176127,35.02
merrick pet care,"Merrick Fresh Selects Frozen Turkey & Brown Rice Dog Food, 18-oz pouch, 7 count",https://www.chewy.com/merrick-fresh-selects-frozen-turkey/dp/1915070,33.95
natural balance,"Natural Balance Limited Ingredient Lamb & Brown Rice Recipe Dry Dog Food, 4-lb bag",https://www.chewy.com/natural-balance-limited-ingredient/dp/29461,16.24
vital essentials,"Vital Essentials Freeze-Dried Raw Beef & Salmon Entree & Mixer Soft Nibs Dog Food, 14-oz bag",https://www.chewy.com/vital-essentials-freeze-dried-raw/dp/1701550,23.39
blue,"Blue Buffalo Wilderness Red Meat & Grains Rocky Mountain Recipe High-Protein Adult Dry Dog Food, 24-lb bag",https://www.chewy.com/blue-buffalo-wilderness-rocky/dp/735574,57.98
vital essentials,"Vital Essentials Freeze-Dried Raw Beef Entree & Mixer Dog Food Crunchy Nibs, 14-oz bag",https://www.chewy.com/vital-essentials-beef-nibs-entree/dp/793582,23.39
biljac,"Bil-Jac Adult Select Chicken Recipe Dry Dog Food, 15-lb bag",https://www.chewy.com/bil-jac-adult-select-chicken-recipe/dp/168819,29.24
justfoodfordogs,"JustFoodForDogs DoItYourself Beef & Russet Potato Recipe Fresh Dog Food Recipe & Nutrient Blend, 4.55-oz bag",https://www.chewy.com/justfoodfordogs-doityourself-beef/dp/394367,21.3
the honest kitchen,"The Honest Kitchen Bone Broth POUR OVERS Chicken Stew Wet Dog Food Topper, 5.5-oz, case of 12",https://www.chewy.com/honest-kitchen-bone-broth-pour-overs/dp/177101,20.2
redbarn,"Redbarn Powerfood Beef High Protein Grain-Free Gently Air Dried Dog Food, 80-oz bag",https://www.chewy.com/redbarn-grain-free-beef-recipe-air/dp/1605590,60.99
stella and chewys,"Stella & Chewy's FreshMade Frozen Fresh High-Protein Beef, Barley & Turkey Dog Food, 16-oz pouch, 4 count",https://www.chewy.com/stella-chewys-freshmade-frozen-fresh/dp/1552678,33.72
the honest kitchen,Bundle: The Honest Kitchen Turkey + Beef Whole Food Clusters Dry Dog Food,https://www.chewy.com/honest-kitchen-grain-free-turkey/dp/730534,43.21
the pets table,"The Pets Table Freshly-Made Frozen Human-Grade Beef Stew Dog Food, 15-oz pouch, 6 count",https://www.chewy.com/pets-table-freshly-made-beef-stew/dp/1384430,39.99
fidos bone broth,"Fido's Bone Broth Simply Grass-Fed Beef Bone Broth Powdered Dog Food Topper, 7-oz jar",https://www.chewy.com/fidos-bone-broth-simply-grass-fed/dp/1767294,13.61
under the weather,"Under the Weather Rice & Chicken Freeze-Dried Dog Food, 6-oz bag, 3 count",https://www.chewy.com/under-weather-rice-chicken-freeze/dp/878710,24.67
natures recipe,"Nature's Recipe Freeze-Dried Chicken, Barley & Brown Rice Dog Food, 10.5-lb bag",https://www.chewy.com/natures-recipe-chicken-barley-brown/dp/1842014,24.04
farmland traditions,"Farmland Traditions The Good List Lamb, Venison & Bone Broth Recipe Adult Gently Air-Dried Dog Food, 16-oz bag",https://www.chewy.com/farmland-traditions-good-list-lamb/dp/1744614,16.89
the pets table,"The Pets Table Lamb & Beef with Brown Rice Air-Dried Dog Food, 16-oz bag",https://www.chewy.com/pets-table-lamb-beef-brown-rice-air/dp/1661790,14.51
the new zealand natural pet food co,"The New Zealand Natural Pet Food Co. Woof Wild Brushtail Grain-Free Freeze-Dried Raw Dog Food, 9.9-oz bag",https://www.chewy.com/new-zealand-natural-pet-food-co-woof/dp/1026702,22.74
natural balance,"Natural Balance Limited Ingredient Grain-Free Salmon & Sweet Potato Recipe Dry Dog Food, 24-lb bag, bundle of 2",https://www.chewy.com/natural-balance-limited-ingredient/dp/29465,125.96
vital essentials,"Vital Essentials Protein Mix-In Duck Recipe Mini Nibs Grain-Free Freeze-Dried Raw Dog Food Topper, 6-oz bag",https://www.chewy.com/vital-essentials-protein-mix-in-duck/dp/846190,16.99
instinct,"Instinct Frozen Raw Bites Grain-Free Wild-Caught Alaskan Pollock Recipe Fresh Dog Food, 5.4-lb bag",https://www.chewy.com/instinct-frozen-raw-bites-grain-free/dp/767414,22.49
instinct,"Bundle: Health & Wellness - Instinct Gut Health Topper, Skin & Coat Topper, Mobility Support Dog Food Topper",https://www.chewy.com/instinct-freeze-dried-raw-boost/dp/696518,29.62
maev,"MAEV Anxiety & Calming Human-Grade Raw Frozen Beef Dog Food, 5-lb bag",https://www.chewy.com/maev-beef-formula-supplemented/dp/1554094,51.35
stella and chewys,"Stella & Chewy's Stella's Super Beef Dinner Patties Freeze-Dried Raw Dog Food, 14-oz bag",https://www.chewy.com/stella-chewys-stellas-super-beef/dp/34229,23.39
vital essentials,"Bundle: Variety Pack - Vital Essentials Freeze-Dried Raw Beef Entree Mini Nibs Dog Food, Chicken & Turkey Flavors",https://www.chewy.com/vital-essentials-freeze-dried-raw/dp/985846,28.26
vital essentials,"Vital Essentials Freeze-Dried Raw Beef Entree & Mixer Soft Nibs Dog Food, 14-oz bag",https://www.chewy.com/vital-essentials-freeze-dried-raw/dp/1701534,23.39
under the weather,"Under the Weather Variety Pack Freeze-Dried Dog Food, 6-oz bag, 3 count",https://www.chewy.com/under-weather-variety-pack-freeze/dp/878806,24.67
stella and chewys,Bundle: Stella & Chewy's Marie's Magical Dinner Freeze-Dried Raw Dust Grass-Fed Beef + Dust Freeze-Dried Raw Cage-Free Chicken Dog Food Topper,https://www.chewy.com/stella-chewys-maries-magical-dinner/dp/971326,26.9
instinct,"Instinct Boost Mixers Multivitamin Grain-Free Freeze-Dried Raw Adult Dog Food Topper, 5.5-oz bag",https://www.chewy.com/instinct-boost-mixers-multivitamin/dp/755702,11.69
the new zealand natural pet food co,"The New Zealand Natural Pet Food Co. Woof Beef Air Dried Dog Food, 3.5-oz bag",https://www.chewy.com/new-zealand-natural-pet-food-co-woof/dp/937542,7.79
stella and chewys,"Stella & Chewy's Perfectly Puppy Beef & Salmon Dinner Patties Freeze-Dried Raw Dog Food, 14-oz bag",https://www.chewy.com/stella-chewys-perfectly-puppy-beef/dp/175016,23.39
farmland traditions,"Farmland Traditions The Good List Chicken & Bone Broth Recipe Adult Gently Air-Dried Dog Food, 16-oz bag",https://www.chewy.com/farmland-traditions-good-list-chicken/dp/1744550,14.29
justfoodfordogs,"JustFoodForDogs JustFresh Human Grade Home-Cooked Pork Recipe Fresh Dog Food, 12-oz pouch, pack of 7",https://www.chewy.com/justfoodfordogs-justfresh-human-grade/dp/1659806,27.97
the new zealand natural pet food co,"The New Zealand Natural Pet Food Co. Woof Venison Air Dried Dog Food, 26.5-oz bag",https://www.chewy.com/new-zealand-natural-pet-food-co-woof/dp/937606,37.99
instinct,"Instinct Raw Meals Grass-Fed Lamb Recipe Grain-Free Adult Freeze-Dried Dog Food, 3-oz bag",https://www.chewy.com/instinct-raw-meals-grass-fed-lamb/dp/296630,5.84
the pets table,"Bundle: The Pets Table Beef & Berries, 16-oz bag + Chicken & Sweet Potato, 16-oz bag + Salmon & Whitefish with Pumpkin Grain-Free Air-Dried Dog Food, 16-oz bag",https://www.chewy.com/pets-table-beef-berries-16-oz-bag/dp/2058030,39.79
natures recipe,"Nature's Recipe Small Breed Grain-Free Chicken, Sweet Potato & Pumpkin Recipe Dry Dog Food, 12-lb bag",https://www.chewy.com/natures-recipe-small-breed-grain-free/dp/36669,19.49
stella and chewys,"Stella & Chewy's Chewy's Chicken Dinner Patties Freeze-Dried Raw Dog Food, 25-oz bag",https://www.chewy.com/stella-chewys-chewys-chicken-dinner/dp/121085,38.99
vital essentials,"Vital Essentials Protein Mix-In Salmon Recipe Mini Nibs Grain-Free Freeze-Dried Raw Dog Food Topper, 6-oz bag",https://www.chewy.com/vital-essentials-protein-mix-in/dp/846238,16.99
because its better,"Because It's Better Real Chicken & Veggies Slow Baked & Air-Dried Dog Food, 3-lb bag",https://www.chewy.com/because-its-better-real-chicken/dp/1838550,25.33
instinct,"Instinct Raw Boost Mixers Frozen Adult Grain-Free Gut Health Recipe Dog Food Topper, 1.25-lb bag",https://www.chewy.com/instinct-boost-mixers-gut-health/dp/328001,5.99
american natural premium,"American Natural Premium Market Fresh Chicken with Apples & Cranberries Freeze-Dried Dog Food, 16-oz bag",https://www.chewy.com/american-natural-premium-market-fresh/dp/2469222,29.44
happy howl,"Happy Howl Tasty Turkey Feast 100% Human-Grade Wet Dog Food, 14.6-oz box, pack of 3",https://www.chewy.com/happy-howl-tasty-turkey-feast-100/dp/1787166,20.56
stella and chewys,"Stella & Chewy's Stella's Super Beef Dinner Patties Freeze-Dried Raw Dog Food, 14-oz bag",https://www.chewy.com/stella-chewys-stellas-super-beef/dp/34229,23.39
bixbi,"BIXBI Rawbble Lamb Recipe Grain-Free Freeze-Dried Dog Food, 12-oz bag",https://www.chewy.com/bixbi-rawbble-lamb-recipe-grain-free/dp/244643,16.32
full moon,"Full Moon Freshly Crafted Free Range Chicken Recipe Grain-Free Adult Frozen Dog Food, 4-lb bag, bundle of 4",https://www.chewy.com/full-moon-freshly-crafted-free-range/dp/1376894,99.99
badlands ranch,"Badlands Ranch Superfood Complete Grain-Free Wild Fish & Turkey Air-Dried Dog Food, 24-oz bag",https://www.chewy.com/badlands-ranch-superfood-complete/dp/1343054,27.94
stella and chewys,"Stella & Chewy's Stella's Solutions Hip & Joint Boost Freeze-Dried Raw Cage-Free Chicken Dinner Morsels Dog Food, 13-oz bag",https://www.chewy.com/stella-chewys-stellas-solutions-hip/dp/203201,20.79
natures diet,"Nature's Diet Fresh Turkey Simply Raw Freeze-Dried Dog Food, 3-lb bag, 3-lb bag, bundle of 2",https://www.chewy.com/natures-diet-fresh-turkey-simply-raw/dp/344415,54.88
weruva,"Weruva Meals 'n More Natural Wet Dog Food, Woof Woof Floof! Skin & Coat Health Variety Pack, 3.5-oz cup, 10 count",https://www.chewy.com/weruva-meals-n-more-natural-wet-dog/dp/578470,16.24
stella and chewys,"Stella & Chewy's Dandy Lamb Dinner Patties Freeze-Dried Raw Dog Food, 25-oz bag",https://www.chewy.com/stella-chewys-dandy-lamb-dinner/dp/168120,38.99
full moon,"Full Moon Freshly Crafted Ranch Raised Beef Recipe Grain-Free Adult Frozen Dog Food, 4-lb bag",https://www.chewy.com/full-moon-freshly-crafted-ranch/dp/1376902,26.32
dog chow,"Dog Chow High Protein with Real Beef & Real Chicken in Savory Gravy Variety Pack Wet Dog Food, 13-oz can, case of 24",https://www.chewy.com/dog-chow-high-protein-real-beef-real/dp/241852,26.32
justfoodfordogs,"JustFoodForDogs Pantry Fresh Beef, Chicken & Turkey Variety Pack Dog Fresh Food, 12.5-oz bag, case of 6",https://www.chewy.com/justfoodfordogs-pantry-fresh-beef/dp/749782,22.99
natures recipe,"Nature's Recipe Grain-Free Chicken, Sweet Potato & Pumpkin Recipe Wet Dog Food, 13-oz can, 12 count",https://www.chewy.com/natures-recipe-grain-free-chicken/dp/1635734,22.74
jac pet nutrition,"JAC Pet Nutrition Air-Dried Shrimp Superfood Crumbles Dog Food Topper, 7-oz pouch",https://www.chewy.com/jac-pet-nutrition-air-dried-shrimp/dp/788278,15.73
evangers,"Evanger's Organics Turkey with Potato & Carrots Dinner Grain-Free Canned Dog Food, 12.5-oz, case of 12",https://www.chewy.com/evangers-organics-turkey-potato/dp/44943,25.67
blue,"Blue Buffalo Wilderness Wolf Creek Stew High-Protein & Grain-Free Hearty Beef in Gravy Wet Dog Food, 12.5-oz can, 12 count",https://www.chewy.com/blue-buffalo-wilderness-wolf-creek/dp/103660,25.35
dr tims,"Dr. Tim's Flavor Booster Genuine Freeze-Dried Dog & Cat Food Topper, 3-oz bottle",https://www.chewy.com/dr-tims-flavor-booster-genuine-freeze/dp/105060,16.49
jinx,"Jinx Salmon & Vegetables Recipe Grain-Free Wet Dog Food, 13-oz can, case of 12",https://www.chewy.com/jinx-salmon-sweet-potato-chopped/dp/765638,19.42
rachael ray nutrish,"Rachael Ray Nutrish Hearty Beef Stew Grain-Free Wet Dog Food, 8-oz tub, case of 8",https://www.chewy.com/rachael-ray-nutrish-natural-hearty/dp/36748,12.9
vital essentials,"Vital Essentials Freeze-Dried Raw Beef Entree & Mixer Dog Food Crunchy Nibs, 14-oz bag",https://www.chewy.com/vital-essentials-beef-nibs-entree/dp/793582,23.39
rachael ray nutrish,"Rachael Ray Nutrish Chicken Paw Pie Grain-Free Wet Dog Food, 8-oz tub, case of 16",https://www.chewy.com/rachael-ray-nutrish-natural-chicken/dp/36747,24.76
bixbi,"BIXBI Rawbble Chicken & Salmon Recipe Grain-Free Freeze-Dried Dog Food, 4.5-oz bag",https://www.chewy.com/bixbi-rawbble-chicken-salmon-recipe/dp/244639,8.02
good n tasty,"Good 'n' Tasty Triple Flavor Mix Salmon, Tuna, & Krill Puree Dog Food Topper, 28 count",https://www.chewy.com/good-n-tasty-triple-flavor-mix-salmon/dp/1364966,11.5
the honest kitchen,"The Honest Kitchen Whole Grain Turkey Recipe Dehydrated Dog Food, 10-lb box",https://www.chewy.com/honest-kitchen-whole-grain-turkey/dp/30089,54.14
purina beyond,"Purina Beyond Natural Pate Ground Entrees Wet Dog Food Variety Pack, 13-oz can, case of 12",https://www.chewy.com/purina-beyond-natural-pate-ground/dp/131227,20.53
purebites,"PureBites Dog Pates Chicken & Beef Food Topping, 2.5-oz can",https://www.chewy.com/purebites-dog-pates-chicken-beef-food/dp/750726,1.49
merrick pet care,"Merrick Lil' Plates Petite Pates Premium Grain-Free Chicken Dinner Wet Dog Food, 3-oz can, case of 24",https://www.chewy.com/merrick-lil-plates-petite-pates-adult/dp/857270,31.04
blue,"Blue Buffalo Homestyle Recipe Chicken Dinner with Garden Vegetables Senior Wet Dog Food, 12.5-oz, case of 12",https://www.chewy.com/blue-buffalo-homestyle-recipe-senior/dp/49581,23.24
merrick pet care,"Merrick Lil’ Plates Dinner Duos Teeny Texas Steak Tips Dinner & Tiny Thanksgiving Day Dinner Variety Pack Grain-Free Wet Dog Food, 3.5-oz tub, case of 12",https://www.chewy.com/merrick-lil-plates-dinner-duos-teeny/dp/578502,18.19
the honest kitchen,"The Honest Kitchen Whole Grain Beef Recipe Dehydrated Dog Food, 10-lb box",https://www.chewy.com/honest-kitchen-whole-grain-beef/dp/30090,57.32
blue,"Blue Buffalo Wilderness Chicken Recipe Adult High-Protein Grain-Free Dry Dog Food, 13-lb bag",https://www.chewy.com/blue-buffalo-wilderness-chicken/dp/28805,28.1
merrick pet care,"Merrick Grain-Free Dry Dog Food Real Bison, Beef & Sweet Potato Recipe, 22-lb bag",https://www.chewy.com/merrick-grain-free-dry-dog-food-real/dp/230017,57.98
stella and chewys,"Stella & Chewy's Chewy's Chicken Dinner Patties Freeze-Dried Raw Dog Food, 25-oz bag",https://www.chewy.com/stella-chewys-chewys-chicken-dinner/dp/121085,38.99
purina beneful,"Purina Beneful Chopped Blends with Salmon, Sweet Potatoes, Brown Rice & Spinach Wet Dog Food, 10-oz container, case of 8",https://www.chewy.com/purina-beneful-chopped-blends-salmon/dp/127565,12.9
vital essentials,"Vital Essentials Freeze-Dried Raw Chicken Entree & Mixer Dog Food Crunchy Mini Nibs, 14-oz bag",https://www.chewy.com/vital-essentials-freeze-dried-raw/dp/820862,20.64
nutrish,"Nutrish Gentle Digestion & Whole Health Blend Premium Pate Variety Pack Wet Dog Food, 13-oz can, case of 12(Rachael Ray)",https://www.chewy.com/rachael-ray-nutrish-premium-pate/dp/790334,18.64
nulo,"Nulo FreeStyle Variety Pack Dog Food Topper, 2.8-oz, case of 12",https://www.chewy.com/nulo-freestyle-variety-pack-dog-food/dp/240639,16.51
blue,"Blue Buffalo Homestyle Recipe Variety Pack Senior Natural Ingredients Beef Dinner & Chicken Dinner Canned Wet Dog Food, 12.5-oz can, 6 count",https://www.chewy.com/blue-buffalo-homestyle-recipe-variety/dp/1345422,11.62
kibbles n bits,"Kibbles 'n Bits Mini Bits Savory Beef & Chicken Flavors Small Breed Dry Dog Food, 16-lb bag",https://www.chewy.com/kibbles-n-bits-small-breed-mini-bits/dp/161005,9.73
big red,"Big Red Nuggets Dry Dog Food, 50-lb bag",https://www.chewy.com/big-red-nuggets-dry-dog-food-50-lb/dp/1505798,20.79
instinct,"Instinct Raw Boost Adult Grain-Free Gut Health Recipe Dry Dog Food, 18-lb bag",https://www.chewy.com/instinct-raw-boost-gut-health-grain/dp/187480,58.49
purina beneful,"Purina Beneful Freshly Prepared Meals Beef & Chicken Medley with Green Beans, Carrots & Wild Rice Wet Dog Food, 10-oz, case of 8",https://www.chewy.com/purina-beneful-prepared-meals-beef/dp/127700,9.83
merrick pet care,"Merrick Limited Ingredient Diet Real Salmon & Brown Rice Recipe with Healthy Grains Dry Dog Food, 22-lb bag",https://www.chewy.com/merrick-limited-ingredient-diet-real/dp/229726,55.98
blue,"Blue Buffalo True Solutions Skin & Coat Natural Salmon Adult Dry Dog Food, 24-lb bag",https://www.chewy.com/blue-buffalo-true-solutions-perfect/dp/244844,48.98
wholesomes,"Wholesomes Sensitive Skin & Stomach with Lamb Protein Dry Dog Food, 30-lb bag",https://www.chewy.com/wholesomes-sensitive-skin-stomach/dp/279000,32.08
earthborn holistic,"Earthborn Holistic Unrefined Roasted Rabbit with Ancient Grains & Superfoods Dry Dog Food, 4-lb bag",https://www.chewy.com/earthborn-holistic-unrefined-roasted/dp/225782,13.64
rachael ray nutrish,"Rachael Ray Nutrish Dish Beef & Brown Rice Recipe with Veggies, Fruit & Chicken Dry Dog Food, 11.5-lb bag",https://www.chewy.com/rachael-ray-nutrish-dish-natural-beef/dp/126248,16.24
purina beyond,"Purina Beyond Grain-Free Chicken, Lamb & Spinach Recipe Ground Entree Canned Dog Food, 13-oz, case of 12",https://www.chewy.com/purina-beyond-grain-free-chicken-lamb/dp/138410,18.97
purina beneful,"Purina Beneful Originals with Natural Salmon Dry Dog Food, 14-lb bag",https://www.chewy.com/purina-beneful-originals-natural/dp/28733,10.71
natural balance,"Natural Balance Limited Ingredient Reserve Grain-Free Sweet Potato & Bison Recipe Dry Dog Food, 22-lb bag",https://www.chewy.com/natural-balance-limited-ingredient/dp/29463,59.99
fidos bone broth,"Fido's Bone Broth Mobility Grass-Fed Beef Bone Broth Powdered Dog Food Topper, 7-oz jar",https://www.chewy.com/fidos-bone-broth-mobility-grass-fed/dp/1767310,19.46
vital essentials,"Vital Essentials Freeze-Dried Raw Duck Entree & Mixer Dog Food Crunchy Mini Nibs, 25-oz bag",https://www.chewy.com/vital-essentials-freeze-dried-raw/dp/820886,39.9
blue,"Blue Buffalo Wilderness Salmon Recipe Adult High-Protein Grain-Free Dry Dog Food, 4.5-lb bag",https://www.chewy.com/blue-buffalo-wilderness-salmon-recipe/dp/28804,14.29
merrick pet care,"Merrick Grain-Free Dry Dog Food Real Bison, Beef & Sweet Potato Recipe, 22-lb bag",https://www.chewy.com/merrick-grain-free-dry-dog-food-real/dp/230014,57.98
