brand,product,url,price
justfoodfordogs,"JustFoodForDogs DoItYourself Turkey & Whole Wheat Macaroni Recipe Fresh Dog Food Recipe & Nutrient Blend, 4-oz bag",https://www.chewy.com/justfoodfordogs-doityourself-turkey/dp/394369,24.69
petplate,"PetPlate FreshBaked Grain-Free Chicken Gently Baked & Air-Dried Human-Grade Dog Food, 32-oz Box, bundle of 6, 12-lbs Total",https://www.chewy.com/petplate-freshbaked-grain-free/dp/1343446,59.91
stella and chewys,"Stella & Chewy's Lil' Bites Chicken Little Recipe Small Breed Freeze-Dried Raw Dog Food, 7-oz bag, bundle of 2",https://www.chewy.com/stella-chewys-lil-bites-chicken/dp/184465,29.89
instinct,"Instinct Bites Lamb Recipe Grain-Free Grass-Fed Raw Frozen Dog Food, 5.4-lb bag, bundle of 3",https://www.chewy.com/instinct-bites-lamb-recipe-grain-free/dp/327994,60.73
vital essentials,"Vital Essentials Rabbit Mini Patties Entree Freeze-Dried Raw Dog Food, 14-oz bag",https://www.chewy.com/vital-essentials-rabbit-mini-patties/dp/204569,29.24
vital essentials,"Vital Essentials Freeze-Dried Raw Lamb & Whitefish Entree & Mixer Soft Nibs Dog Food, 14-oz bag",https://www.chewy.com/vital-essentials-freeze-dried-raw/dp/1701566,23.39
stella and chewys,"Stella & Chewy's Freeze-Dried Raw Meal Mixers Grain-Free Protein Rich Beef & Salmon Recipe Dog Food, 3.5-oz bag",https://www.chewy.com/stella-chewys-freeze-dried-raw-meal/dp/842062,7.14
the honest kitchen,"The Honest Kitchen Gourmet Grains Turkey & White Fish Recipe Dehydrated Dog Food, 4-lb box",https://www.chewy.com/honest-kitchen-gourmet-grains-turkey/dp/352264,29.93
merrick pet care,"Merrick Grain-Free Real Salmon & Sweet Potato Recipe Dry Dog Food, 4-lb bag",https://www.chewy.com/merrick-grain-free-chicken-free-real/dp/104978,17.54
maev,"MAEV Hip & Joint Human-Grade Raw Frozen Beef Dog Food, 20-lb bundle",https://www.chewy.com/maev-beef-formula-supplemented-hip/dp/1554062,116.35
grandma lucys,"Grandma Lucy's Artisan Chicken Grain-Free Freeze-Dried Dog Food, 3-lb bag",https://www.chewy.com/grandma-lucys-artisan-chicken-grain/dp/36491,17.74
inukshuk,"Inukshuk Performance Marine 26/16 Dog Dry Food, 33-lb bag",https://www.chewy.com/inukshuk-performance-marine-16-dog/dp/764094,49.12
nutrish,"Nutrish High Protein Beef, Potato & Peas Recipe with Venison & Lamb Dry Dog Food, 4-lb bag (Rachael Ray)",https://www.chewy.com/rachael-ray-nutrish-peak-open-prairie/dp/135896,9.74
badlands ranch,"Badlands Ranch Superfood Complete Beef & Bison Grain-Free Air-Dried Dog Food, 11.5-oz bag, bundle of 2",https://www.chewy.com/badlands-ranch-superfood-complete/dp/1670222,44.44
justfoodfordogs,"JustFoodForDogs DoItYourself Fish & Sweet Potato Recipe Fresh Dog Food Recipe & Nutrient Blend, 5.92-oz bag",https://www.chewy.com/justfoodfordogs-doityourself-fish/dp/394371,24.69
birdie louie,"Birdie & Louie Grain-Free Buffalo & Duck Dry Dog Food, 3.5-lb bag",https://www.chewy.com/birdie-louie-grain-free-buffalo-duck/dp/1067102,10.33
natural balance,"Natural Balance Limited Ingredient Beef & Brown Rice Recipe Dry Dog Food, 24-lb bag",https://www.chewy.com/natural-balance-limited-ingredient/dp/303513,52.98
halo,"Halo Meal Bites Beef Recipe Raw Freeze-Dried Dog Food, 14-oz bag",https://www.chewy.com/halo-meal-bites-beef-recipe-raw/dp/103042,25.99
i and love and you,"I and Love and You Stir and Boom Raw Raw Beef Boom Ba Dinner Grain-Free Dehydrated Dog Food, 3-lb bag",https://www.chewy.com/i-love-you-stir-boom-raw-raw-beef/dp/117043,32.49
bixbi,"BIXBI Rawbble Turkey Recipe Grain-Free Freeze-Dried Dog Food, 26-oz bag",https://www.chewy.com/bixbi-rawbble-turkey-recipe-grain/dp/244651,40.29
justfoodfordogs,"JustFoodForDogs Turkey & Whole Wheat Macaroni Recipe Frozen Human-Grade Fresh Dog Food, 18-oz pouch, case of 14",https://www.chewy.com/justfoodfordogs-turkey-whole-wheat/dp/394307,79.19
instinct,Bundle: Instinct Raw Boost Recipe with Real Beef & Freeze-Dried Raw Pieces Dry Food + Frozen Raw Bites Real Beef Recipe Dog Food,https://www.chewy.com/instinct-raw-boost-grain-free-recipe/dp/693358,76.04
360 pet nutrition,"360 Pet Nutrition Beef Grain-Free Adult Freeze-Dried Dog Food, 48-oz bag",https://www.chewy.com/360-pet-nutrition-beef-grain-free/dp/2475094,66.47
the pets table,"The Pets Table Freshly-Made Frozen Human-Grade Chicken Casserole Dog Food, 16-oz pouch, 6 count",https://www.chewy.com/pets-table-freshly-made-chicken/dp/1384454,35.01
dog chow,"Dog Chow Kibble Beef Flavor Complete Dry Dog Food, 18.5-lb bag",https://www.chewy.com/dog-chow-kibble-beef-flavor-complete/dp/918870,10.39
stella and chewys,"Stella & Chewy's Freeze-Dried Raw Surf & Turf Meal Mixer Grain-Free Protein Rich Recipe Dog Food Topper, 3.5-oz bag",https://www.chewy.com/stella-chewys-freeze-dried-raw-surf/dp/842086,7.14
country vet naturals,"Country Vet Naturals 24/14 Healthy Diet Dry Dog Food, 35-lb bag",https://www.chewy.com/country-vet-naturals-2414-healthy/dp/225803,27.41
the honest kitchen,Bundle: The Honest Kitchen Chicken + Beef Whole Food Clusters Dry Dog Food,https://www.chewy.com/honest-kitchen-grain-free-chicken/dp/730518,128.01
stella and chewys,Bundle: Stella & Chewy's Stella's Solutions Skin & Coat Lamb & Salmon + Hip & Joint Boost Chicken Freeze-Dried Dog Food,https://www.chewy.com/stella-chewys-stellas-solutions-skin/dp/566854,41.59
ultimate pet nutrition,"Ultimate Pet Nutrition Nutra Complete Premium Pork Freeze-Dried Raw Dog Food, 16-oz bag",https://www.chewy.com/ultimate-pet-nutrition-nutra-complete/dp/751030,24.69
american journey,"American Journey Limited Ingredient Venison & Sweet Potato Recipe Grain-Free Dry Dog Food, 24-lb bag",https://www.chewy.com/american-journey-limited-ingredient/dp/167847,40.94
blue,"Blue Buffalo Wilderness Adult High Protein Natural Duck & Wholesome Grains Dry Dog Food, 4.5-lb bag",https://www.chewy.com/blue-buffalo-wilderness-adult-high/dp/735462,14.27
dr tims,"Dr. Tim's Active Dog Pursuit Formula Dry Dog Food, 40-lb bag",https://www.chewy.com/dr-tims-active-dog-pursuit-formula/dp/37811,99.39
victor,"VICTOR Gluten-Free Professional Active High Protein Sporting Dry Dog Food, 5-lb bag, bundle of 2",https://www.chewy.com/victor-classic-professional-formula/dp/120685,20.79
purina beneful,"Purina Beneful Originals with Farm-Raised Chicken Dry Dog Food, 3.5-lb bag",https://www.chewy.com/purina-beneful-originals-farm-raised/dp/1687702,4.87
justfoodfordogs,"JustFoodForDogs Sensitive Skin & Stomach Variety Pack Human-Grade Fresh Whole Dog Food, 18-oz pouch, case of 7",https://www.chewy.com/justfoodfordogs-sensitive-skin/dp/663382,43.99
solid gold,"Solid Gold Toy & Small Breed Grain-Free Real Beef, Sweet Potato & Apple Dry Dog Food, 11-lb bag",https://www.chewy.com/solid-gold-mighty-mini-small-toy/dp/177401,28.59
merrick pet care,"Merrick Limited Ingredient Diet Grain-Free Chicken-Free Real Lamb & Sweet Potato Recipe Dry Dog Food, 22-lb bag",https://www.chewy.com/merrick-limited-ingredient-diet-grain/dp/229715,55.98
chicken,"Vital Essentials Freeze-Dried Raw Protein Mix-In Chicken Recipe Ground Dog Food Topper, 6-oz bag",https://www.chewy.com/vital-essentials-freeze-dried-raw/dp/53577,11.04
health extension,"Health Extension Chicken Recipe Non-GMO Air-Dried Dog Food, 2-lb bag",https://www.chewy.com/health-extension-chicken-recipe-non/dp/972222,33.83
under the weather,"Under the Weather Rice, Hamburger & Sweet Potato Freeze-Dried Dog Food, 6-oz bag, 3 count",https://www.chewy.com/under-weather-rice-hamburger-sweet/dp/878742,24.67
bully max,"Bully Max Beef High Protein Freeze-Dried Raw Dog Food Topper, 7-oz pouch",https://www.chewy.com/bully-max-beef-flavor-freeze-dried/dp/1323998,14.85
stella and chewys,"Stella & Chewy's Dandy Lamb Patties Frozen Raw Dog Food, 6-lb bag",https://www.chewy.com/stella-chewys-frozen-dandy-lamb/dp/2031630,39.74
nulo,"Nulo Gently-Cooked Meals Salmon & Brown Rice Recipe Wet Dog Food, 9-oz pouch, case of 8, bundle of 2",https://www.chewy.com/nulo-adult-high-protein-salmon-brown/dp/1111838,93.84
true acre foods,"True Acre Foods Large Breed Chicken & Vegetables Recipes Grain-Free Dry Dog Food, 30-lb bag",https://www.chewy.com/true-acre-foods-large-breed-chicken/dp/274452,28.59
badlands ranch,"Badlands Ranch Superfood Complete Raw Coated Morsels Chicken Dry Dog Food, 10-lb bag",https://www.chewy.com/badlands-ranch-superfood-complete-raw/dp/1715526,42.24
grandma lucys,"Grandma Lucy's Artisan Pork Grain-Free Freeze-Dried Dog Food, 1-lb bag",https://www.chewy.com/grandma-lucys-artisan-pork-grain-free/dp/36493,8.42
stella and chewys,"Stella & Chewy's Remarkable Red Meat Recipe Dinner Patties Freeze-Dried Raw Dog Food, 14-oz bag",https://www.chewy.com/stella-chewys-remarkable-red-meat/dp/177509,23.39
the new zealand natural pet food co,"The New Zealand Natural Pet Food Co. Woof Wild Venison Recipe Grain-Free Freeze-Dried Dog Food, 9-oz bag",https://www.chewy.com/new-zealand-natural-pet-food-co-woof/dp/290033,25.03
evolve,"Evolve Classic Deboned Chicken & Brown Rice Recipe Dry Dog Food, 30-lb bag",https://www.chewy.com/evolve-classic-deboned-chicken-brown/dp/107695,35.22
bixbi,"BIXBI Rawbble Chicken Recipe Grain-Free Freeze-Dried Dog Food, 12-oz bag",https://www.chewy.com/bixbi-rawbble-chicken-recipe-grain/dp/244627,18.52
stewart,"Stewart Raw Coated Lamb Limited-Ingredient Adult Freeze-Dried Dog Food, 4-lb bag",https://www.chewy.com/stewart-raw-coated-lamb-limited/dp/1669062,17.54
grandma lucys,"Grandma Lucy's Artisan Grain-Free/Freeze-Dried Dog Food Pre-Mix, 8-lb bag",https://www.chewy.com/grandma-lucys-artisan-grain/dp/36496,40.99
the honest kitchen,"The Honest Kitchen Chicken Recipe Grain-Free Dehydrated Dog Food, 2-lb box",https://www.chewy.com/honest-kitchen-chicken-recipe-grain/dp/30086,19.49
simple food project,"Simple Food Project Beef & Salmon Recipe Freeze-Dried Dog Food, 3-lb box",https://www.chewy.com/simple-food-project-beef-salmon/dp/1996078,50.07
solid gold,"Solid Gold Real Lamb, Brown Rice & Pearled Barley Recipe Whole Grain Dry Dog Food, 4-lb bag",https://www.chewy.com/solid-gold-hund-n-flocken-lamb-brown/dp/30047,12.99
stella and chewys,"Stella & Chewy's SuperBlends Raw Blend Wholesome Grains Grass-Fed Beef, Beef Liver & Lamb Recipe with Superfoods Dry Dog Food, 21-lb bag",https://www.chewy.com/stella-chewys-superblends-raw-blend/dp/825982,63.04
wholesomes,"Wholesomes with Lamb Meal & Rice Formula Dry Dog Food, 40-lb bag",https://www.chewy.com/wholesomes-lamb-meal-rice-formula-dry/dp/118403,33.79
natural balance,"Natural Balance Limited Ingredient Salmon & Brown Rice Recipe Dry Dog Food, 24-lb bag",https://www.chewy.com/natural-balance-limited-ingredient/dp/243224,52.98
naavi,"Naavi Slow Roasted Turkey Bowl Air Dried Dog Food, 32-oz bag",https://www.chewy.com/naavi-slow-roasted-turkey-bowl-dry/dp/1616902,25.98
natural balance,"Natural Balance Fat Dogs Chicken & Salmon Formula Low Calorie Dry Dog Food, 24-lb bag",https://www.chewy.com/natural-balance-fat-dogs-chicken/dp/46800,49.98
kibbles n bits,"Kibbles 'n Bits Bistro Mini Bits Beef, Vegetable & Apple Small Breed Dry Dog Food, 3.5-lb bag",https://www.chewy.com/kibbles-n-bits-bistro-mini-bits-beef/dp/1041062,3.88
ultimates,"Ultimates Lamb Meal & Brown Rice Dry Dog Food, 28-lb bag",https://www.chewy.com/ultimates-lamb-meal-brown-rice-dry/dp/120282,30.1
justfoodfordogs,"JustFoodForDogs Pantry Fresh Turkey & Whole Wheat Macaroni Fresh Dog Food, 12.5-oz pouch, case of 1",https://www.chewy.com/justfoodfordogs-pantry-fresh-turkey/dp/394351,7.49
instinct,"Instinct Raw Meals Cage-Free Chicken Recipe Grain-Free Puppy Freeze-Dried Dog Food, 3-oz bag",https://www.chewy.com/instinct-raw-meals-cage-free-chicken/dp/296635,5.84
vital essentials,"Vital Essentials Freeze-Dried Raw Rabbit Entree & Mixer Dog Food Crunchy Mini Nibs, 14-oz bag",https://www.chewy.com/vital-essentials-freeze-dried-raw/dp/820910,29.24
blue,"Blue Buffalo Life Protection Formula Small Breed Senior Chicken & Brown Rice Recipe Dry Dog Food, 5-lb bag",https://www.chewy.com/blue-buffalo-life-protection-formula/dp/28824,11.04
american journey,"American Journey Grain-Free Chicken & Sweet Potato Recipe Dry Dog Food, 12-lb bag",https://www.chewy.com/american-journey-grain-free-chicken/dp/135806,24.69
go solutions,"Go! Solutions Digestion + Gut Health Salmon Recipe with Ancient Grains for Dogs, 12-lb bag",https://www.chewy.com/go-solutions-digestion-gut-health/dp/539518,33.79
the honest kitchen,"The Honest Kitchen Grain-Free Chicken Whole Food Clusters Dry Dog Food, 20-lb bag",https://www.chewy.com/honest-kitchen-grain-free-chicken/dp/177083,60.51
atta boy,"Atta Boy Grilled Chicken & Rice Flavor Dry Dog Food, 16.5-lb bag",https://www.chewy.com/atta-boy-grilled-chicken-rice-flavor/dp/222825,14.9
stella and chewys,"Stella & Chewy's Raw Blend Red Meat Recipe Grain-Free Dry Dog Food, 3.5-lb bag",https://www.chewy.com/stella-chewys-raw-blend-red-meat/dp/2056950,20.47
wholesomes,Bundle: Wholesomes Grain-Free Beef Meal & Potatoes Formula + Whitefish Meal & Potatoes Formula Dry Dog Food,https://www.chewy.com/wholesomes-grain-free-beef-meal/dp/822790,81.42
stella and chewys,"Stella & Chewy's Wild Red Raw Coated Kibble Wholesome Grains Ocean Recipe Dry Dog Food, 3.5-lb bag",https://www.chewy.com/stella-chewys-wild-red-raw-coated/dp/317988,14.29
fur valley,"Fur Valley Salmon Freeze-Dried Dog & Cat Food Topper, 5-oz bag",https://www.chewy.com/fur-valley-salmon-freeze-dried-dog/dp/970950,11.33
stella and chewys,"Stella & Chewy's Stella's Super Beef Patties Frozen Raw Dog Food, 12-lb bag",https://www.chewy.com/stella-chewys-stellas-super-beef/dp/1826006,67.49
blue,"Blue Buffalo Wilderness Chicken Recipe High-Protein Healthy Weight Large Breed Adult Dry Dog Food, 28-lb bag",https://www.chewy.com/blue-buffalo-wilderness-large-breed/dp/735542,59.98
halo,"Halo Holistic Vegan Complete Digestive Health Plant-Based Recipe with Kelp Adult Formula Dry Dog Food, 21-lb bag",https://www.chewy.com/halo-holistic-vegan-complete/dp/290122,55.24
zignature,"Zignature Turkey Limited Ingredient Formula Dry Dog Food, 4-lb bag",https://www.chewy.com/zignature-turkey-limited-ingredient/dp/36730,9.74
sojos,"Sojos Mix-A-Meal Fruit & Veggie Pre-Mix Grain-Free Dog Food, 8-lb bag",https://www.chewy.com/sojos-mix-meal-fruit-veggie-pre-mix/dp/35229,101.64
simple food project,"Simple Food Project Bison Recipe Freeze-Dried Dog Food, 6-lb box",https://www.chewy.com/simple-food-project-bison-recipe/dp/1996142,100.36
american journey,"American Journey Limited Ingredient Duck & Sweet Potato Recipe Grain-Free Dry Dog Food, 24-lb bag, bundle of 2",https://www.chewy.com/american-journey-limited-ingredient/dp/148471,84.68
wishbone,"Wishbone Mix & Munch Raw Beef & Venison High Protein Grain-Free Adult Freeze-Dried Dog Food, 12.35-oz bag",https://www.chewy.com/wishbone-mix-munch-raw-beef-venison/dp/1128574,19.5
naavi,"Naavi Slow Roasted Chicken Bowl Air Dried Dog Food, 6-oz bag",https://www.chewy.com/naavi-slow-roasted-chicken-bowl-dry/dp/1616894,6.49
grandma lucys,"Grandma Lucy's 3 Bears Chicken Freeze-Dried Dog Food, 8-lb bag",https://www.chewy.com/grandma-lucys-3-bears-chicken-freeze/dp/1470542,43.99
nulo,"Nulo Chicken & Blueberries Grain-Free Freeze-Dried Raw Dog Food, 8-oz bag",https://www.chewy.com/nulo-chicken-blueberries-grain-free/dp/1331078,13.64
nulo,"Nulo Gently-Cooked Meals Duck & Quinoa Recipe Wet Dog Food, 9-oz pouch, case of 8, 9-oz pouch, case of 8, bundle of 2",https://www.chewy.com/nulo-adult-high-protein-duck-quinoa/dp/1111822,93.84
the honest kitchen,"The Honest Kitchen Turkey Recipe Grain-Free Dehydrated Dog Food, 10-lb box",https://www.chewy.com/honest-kitchen-turkey-recipe-grain/dp/30088,73.25
the honest kitchen,"The Honest Kitchen Beef Recipe Grain-Free Dehydrated Dog Food, 10-lb box",https://www.chewy.com/honest-kitchen-beef-recipe-grain-free/dp/35482,84.49
caru,"Caru Grass-Fed Beef Bone Broth Human-Grade Dog & Cat Wet Food Topper, 1.1-lb box",https://www.chewy.com/caru-grass-fed-beef-bone-broth-human/dp/134213,7.33
justfoodfordogs,"JustFoodForDogs Fish & Sweet Potato Recipe Frozen Human-Grade Fresh Dog Food, 18-oz pouch, case of 21",https://www.chewy.com/justfoodfordogs-fish-sweet-potato/dp/394311,115.49
happy howl,"Happy Howl Grandma's Beef Stew 100% Human-Grade Wet Dog Food, 14.6-oz box, pack of 3",https://www.chewy.com/happy-howl-grandmas-beef-stew-100/dp/1787150,21.4
honey im home,"Honey I'm Home! Terrifically Tripe Natural Water Buffalo Dog Meal Topper, 2.61-oz bag",https://www.chewy.com/honey-im-home-terrifically-tripe/dp/2301294,7.49
muenster,"Muenster Perfect Balance Pork Meal Medley with Beef Bites Freeze-Dried Dog Food, 3.5-lb bag",https://www.chewy.com/muenster-perfect-balance-pork-meal/dp/1997246,12.34
wholesomes,Bundle: Wholesomes Chicken Meal & Potatoes Formula + Beef Meal & Potatoes Formula Dry Dog Food,https://www.chewy.com/wholesomes-chicken-meal-potatoes/dp/822782,78.86
natures advantage,"Nature's Advantage Red Meat Mini Nibs Grain-Free Freeze-Dried Raw Dog Food, 14-oz bag",https://www.chewy.com/natures-advantage-red-meat-mini-nibs/dp/1311062,33.49
instinct,"Instinct FreshRaw Meals Grain-Free Grass-Fed Lamb Recipe Dog Food, 16-oz, case of 6",https://www.chewy.com/instinct-freshraw-meals-grain-free/dp/2076542,32.97
stella and chewys,"Stella & Chewy's FreshMade Frozen Fresh Grain-Free Gobblin' Good Dog Food, 16-oz pouch, 8 count",https://www.chewy.com/stella-chewys-freshmade-frozen-fresh/dp/1552726,60.72
merrick pet care,"Merrick Grain-Free Dry Puppy Food Real Beef & Sweet Potato Recipe, 4-lb bag",https://www.chewy.com/merrick-grain-free-dry-puppy-food/dp/144974,16.89
the honest kitchen,"The Honest Kitchen Fruit & Veggie Grain-Free Dehydrated Dog Base Mix, 3-lb box",https://www.chewy.com/honest-kitchen-fruit-veggie-grain/dp/30085,22.29
bixbi,"BIXBI RAWBBLE Fresh Pork Recipe Limited Ingredient Grain-Free Dry Dog Food, 24-lb bag",https://www.chewy.com/bixbi-rawbble-fresh-pork-recipe/dp/255263,53.29
zignature,"Zignature Pork Limited Ingredient Formula Dry Dog Food, 4-lb bag",https://www.chewy.com/zignature-pork-limited-ingredient/dp/141396,12.1
dr garys best breed,"Dr. Gary's Best Breed Holistic Grain-Free Ocean Salmon with Fruits & Vegetables Dry Dog Food, 26-lb bag",https://www.chewy.com/dr-garys-best-breed-holistic-grain/dp/121498,50.69
smallbatch pets,"Smallbatch Pets Super Booster Duck Bites Grain-Free Adult Freeze-Dried Dog & Cat Treats, 7-oz bag",https://www.chewy.com/smallbatch-pets-super-booster-duck/dp/1324518,18.19
blue,"Blue Buffalo Wilderness Chicken Recipe High-Protein Senior Dry Dog Food, 4.5-lb bag",https://www.chewy.com/blue-buffalo-wilderness-senior-high/dp/748318,12.99
justfoodfordogs,"JustFoodForDogs Puppy Variety Pack Fish & Chicken Fresh Puppy Food, 18-oz pouch, case of 7",https://www.chewy.com/justfoodfordogs-puppyvariety-pack/dp/663366,38.49
mission farms,"Mission Farms Wild-Caught Salmon & Pumpkin Adult Freeze-Dried Dog Food, 14-oz bag",https://www.chewy.com/mission-farms-wild-caught-salmon/dp/1272662,22.09
earth animal,"Earth Animal Wisdom Air-Dried Turkey Recipe Premium Natural Dog Food, 128-oz bag",https://www.chewy.com/earth-animal-wisdom-air-dried-turkey/dp/840094,99.99
stella and chewys,"Stella & Chewy's Meal Mixers Purely Pork Freeze-Dried Raw Dog Food Topper, 18-oz bag, bundle of 2",https://www.chewy.com/stella-chewys-meal-mixers-purely-pork/dp/203209,58.49
full moon,"Bundle: Full Moon Freshly Crafted Homestead Turkey Recipe + Free Range Chicken Recipe + Ranch Raised Beef Recipe Grain-Free Adult Frozen Dog Food, 4-lb bags",https://www.chewy.com/full-moon-freshly-crafted-homestead/dp/1404046,75.99
happy howl,"Happy Howl Lamb Delight 100% Human-Grade Wet Dog Food, 14.6-oz box, pack of 3",https://www.chewy.com/happy-howl-lamb-delight-100-human/dp/1787134,23.41
herbsmith,"Herbsmith Smiling Dog Kibble Seasoning Freeze-Dried Duck with Oranges Dog Food Topper, 3-oz bottle",https://www.chewy.com/herbsmith-smiling-dog-kibble/dp/112292,9.74
stewart,"Stewart Puff Tops Beef, Cheese & Cranberry Recipe Limited-Ingredient Freeze-Dried Dog Food Topper, 6-oz pouch",https://www.chewy.com/stewart-puff-tops-beef-cheese/dp/1603542,10.84
natures advantage,"Nature's Advantage Duck & Pheasant Mini Nibs Grain-Free Freeze-Dried Raw Dog Food, 14-oz bag",https://www.chewy.com/natures-advantage-duck-pheasant-mini/dp/1310814,35.99
stella and chewys,"Stella & Chewy's Chewy's Chicken Patties Frozen Raw Dog Food, 6-lb bag",https://www.chewy.com/stella-chewys-chewys-chicken-patties/dp/1825982,34.49
petplate,"PetPlate Human Grade Power Packed Pork Entree Fresh Dog Food, 12-oz cup, case of 12",https://www.chewy.com/petplate-human-grade-care-free-coat/dp/878582,54.0
i and love and you,"I and Love and You Irresist-a-Bowls Grain-Free Chicken & Beef Recipe Dog Food, 9-oz pouch, 8 count",https://www.chewy.com/i-love-you-irresist-bowls-grain-free/dp/533982,25.99
health extension,"Health Extension Beef Recipe Non-GMO Air-Dried Dog Food, 12-oz bag",https://www.chewy.com/health-extension-beef-recipe-non-gmo/dp/972238,15.59
because its better,"Because It's Better Real Salmon & Veggies Slow Baked & Air-Dried Dog Food, 1-lb bag",https://www.chewy.com/because-its-better-real-salmon/dp/1838590,8.44
grandma lucys,"Grandma Lucy's Artisan Lamb Grain-Free Freeze-Dried Dog Food, 10-lb bag",https://www.chewy.com/grandma-lucys-artisan-lamb-grain-free/dp/36492,79.07
grandma lucys,"Grandma Lucy's Artisan Venison Grain-Free Freeze-Dried Dog Food, 10-lb bag",https://www.chewy.com/grandma-lucys-artisan-venison-grain/dp/36494,86.99
shepherd boy farms,"Shepherd Boy Farms Fish Medley Recipe Freeze-Dried Dog Food, 14-oz bag",https://www.chewy.com/shepherd-boy-farms-fish-medley-recipe/dp/1549814,27.27
smallbatch pets,"Smallbatch Pets Beef Non-GMO Freeze-Dried Dog Food, 14-oz bag",https://www.chewy.com/smallbatch-pets-beef-sliders-non-gmo/dp/1324350,24.69
stella and chewys,"Stella & Chewy's Chewy's Chicken Morsels Frozen Raw Dog Food, 4-lb bag",https://www.chewy.com/stella-chewys-chewys-chicken-morsels/dp/1924430,26.24
stella and chewys,"Stella & Chewy's Stella's Solutions Digestive Boost Freeze-Dried Raw Grass-Fed Beef Dinner Morsels Dog Food, 13-oz bag, bundle of 2",https://www.chewy.com/stella-chewys-stellas-solutions/dp/203199,41.59
stella and chewys,"Stella & Chewy's Stella’s Shredrs Cage Free Chicken Recipe in Broth Adult Wet Dog Food, 2.8-oz pouch, case of 24",https://www.chewy.com/stella-chewys-stellas-shredrs-cage/dp/565126,34.16
shepherd boy farms,"Shepherd Boy Farms Rabbit Recipe Freeze-Dried Dog Food, 14-oz bag",https://www.chewy.com/shepherd-boy-farms-rabbit-recipe/dp/1549790,30.68
chicken turkey cookout,"Nom Nom Freshly-Made Frozen Turkey & Chicken Cookout Dog Food, 7.9-oz pouch, case of 7",https://www.chewy.com/nom-nom-freshly-made-frozen-chicken/dp/1919046,32.04
the honest kitchen,"The Honest Kitchen Gourmet Grains Chicken & Duck Recipe Dehydrated Dog Food, 4-lb box",https://www.chewy.com/honest-kitchen-gourmet-grains-chicken/dp/352261,29.93
smallbatch pets,"Smallbatch Pets Chicken Non-GMO Freeze-Dried Dog Food, 25-oz bag, bundle of 2",https://www.chewy.com/smallbatch-pets-chicken-sliders-non/dp/1324454,99.68
tender true,"Tender & True Farmers Market Recipe Freeze-Dried Raw Dog Food, 1-lb bag",https://www.chewy.com/tender-true-farmers-market-recipe/dp/289145,19.49
merrick pet care,"Merrick Healthy Grains Real Salmon & Brown Rice Recipe with Ancient Grains Dry Dog Food, 4-lb bag",https://www.chewy.com/merrick-healthy-grains-real-salmon/dp/291521,16.89
instinct,"Instinct Boost Mixers Healthy Energy Grain-Free Freeze-Dried Raw Dog Food Topper, 5.5-oz bag",https://www.chewy.com/instinct-boost-mixers-healthy-energy/dp/755726,9.87
stella and chewys,"Stella & Chewy's Wild Red Raw Coated Kibble Grain-Free Red Meat Recipe Dry Dog Food, 3.5-lb bag",https://www.chewy.com/stella-chewys-wild-red-raw-coated/dp/317970,14.29
merrick pet care,"Merrick Gut Healthy Grains Recipe Adult Natural Chicken & Rice Yogurt-Infused Clusters Dry Dog Food, 20-lb bag",https://www.chewy.com/merrick-gut-healthy-grains-recipe/dp/1113062,59.99
tender true,"Tender & True Organic Grain-Free Chicken & Liver Recipe Dry Dog Food, 20-lb bag",https://www.chewy.com/tender-true-organic-grain-free/dp/142550,70.99
holi,"HOLI Beef Liver, Lamb Liver, Rabbit Variety Pack Grain-Free Freeze-Dried Dog & Cat Food Topper, 2-oz bag, 3 count",https://www.chewy.com/holi-beef-liver-lamb-liver-rabbit/dp/1046678,18.08
chicken soup for the soul,"Chicken Soup for the Soul Small Bites Adult Chicken, Turkey & Brown Rice Recipe Dog Food, 13.5-lb bag",https://www.chewy.com/chicken-soup-soul-small-bites-chicken/dp/105782,21.44
instinct,"Instinct Raw Boost Small Breed Adult Grain-Free Real Chicken Recipe Dry Dog Food, 10-lb bag",https://www.chewy.com/instinct-raw-boost-small-breed-grain/dp/120943,35.09
holistic select,"Holistic Select Adult Health Lamb Meal Recipe Dry Dog Food, 30-lb bag",https://www.chewy.com/holistic-select-adult-health-lamb/dp/29240,63.99
victor,"VICTOR Grain-Free Active High Protein Dry Dog Food, 30-lb bag",https://www.chewy.com/victor-purpose-active-dog-puppy/dp/120697,45.69
american natural premium,"American Natural Premium Market Fresh Legume-Free Pork Recipe with Pumpkin & Apples Dry Dog Food, 4-lb bag, 4lb/5case",https://www.chewy.com/american-natural-premium-market-fresh/dp/1443742,8.89
sprankles,"Sprankles Chicken Recipe Raw Freeze-Dried Dog Food & Topper, 8-oz bag",https://www.chewy.com/sprankles-chicken-recipe-freeze-dried/dp/842862,10.82
squarepet,"SquarePet VFS Digestive Support Low Fat Formula Dry Dog Food, 22-lb bag",https://www.chewy.com/squarepet-vfs-digestive-support-low/dp/323372,74.99
victor,"VICTOR Sensitive Skin & Stomach Salmon Meal & Brown Rice Recipe Dry Dog Food, 30-lb bag",https://www.chewy.com/victor-sensitive-skin-stomach-salmon/dp/1810046,37.69
natural balance,"Natural Balance Limited Ingredient Grain-Free Chicken & Sweet Potato Recipe Dry Dog Food, 12-lb bag",https://www.chewy.com/natural-balance-limited-ingredient/dp/29464,31.19
